{"$schema":"https://json-schema.org/draft/2020-12/schema","$id":"https://unboundedaxiom.org/spec/opensound/0.1/observation.schema.json","title":"Open Sound Observation v0.1","type":"object","required":["object_type","schema_version","observation_id","created_at","created_by","native_assets","region_refs","provenance","analysis_attempt_refs","hypothesis_refs","reconstruction_refs","residual_refs","evidence_refs","revision_refs"],"properties":{"object_type":{"const":"observation"},"schema_version":{"const":"opensound-observation-0.1"},"observation_id":{"type":"string","minLength":1},"created_at":{"type":"string"},"created_by":{"type":"string","minLength":1},"native_assets":{"type":"array"},"region_refs":{"type":"array"},"provenance":{"type":"object"},"analysis_attempt_refs":{"type":"array","items":{"type":"string"}},"hypothesis_refs":{"type":"array","items":{"type":"string"}},"reconstruction_refs":{"type":"array","items":{"type":"string"}},"residual_refs":{"type":"array","items":{"type":"string"}},"evidence_refs":{"type":"array","items":{"type":"string"}},"revision_refs":{"type":"array","items":{"type":"string"}}},"additionalProperties":true}
